{
  "id": "alien-invasion",
  "name": "Alien Invasion",
  "version": "1.0.0",
  "author": "PwnThemAll Team",
  "description": "Neon sci-fi theme with alien aesthetics and glowing effects",
  "colors": {
    "primary": "#39FF14",
    "primaryHover": "#2ECC11",
    "secondary": "#8B00FF",
    "secondaryHover": "#7500D9",
    "accent": "#BFFF00",
    "background": "#0A0E27",
    "backgroundAlt": "#0D1131",
    "surface": "#1A1F3A",
    "surfaceHover": "#252B4A",
    "surfaceActive": "#2D3555",
    "text": "#FFFFFF",
    "textMuted": "#A0A0B0",
    "textInverted": "#0A0E27",
    "border": "#39FF14",
    "borderHover": "#2ECC11",
    "success": "#39FF14",
    "successHover": "#2ECC11",
    "danger": "#FF1744",
    "dangerHover": "#E6003D",
    "warning": "#FFD700",
    "warningHover": "#FFC700",
    "info": "#00D9FF",
    "infoHover": "#00C3E6",
    "solved": "#39FF14",
    "locked": "#8B00FF",
    "shadow": "#000000",
    "shadowGlow": "#39FF14"
  },
  "typography": {
    "fontFamily": {
      "heading": "'Orbitron', 'Exo 2', sans-serif",
      "body": "'Rajdhani', 'Roboto', sans-serif",
      "mono": "'Share Tech Mono', 'Courier New', monospace"
    },
    "scale": "normal",
    "fontWeights": {
      "normal": 400,
      "medium": 500,
      "semibold": 600,
      "bold": 700
    },
    "lineHeights": {
      "tight": 1.2,
      "normal": 1.5,
      "relaxed": 1.7
    }
  },
  "spacing": {
    "scale": 1.05,
    "containerPadding": "1.25rem",
    "sectionGap": "2.5rem"
  },
  "layout": {
    "cardStyle": "elevated",
    "cardCorners": "rounded",
    "headerStyle": "bold",
    "tableStyle": "bordered",
    "badgeShape": "pill",
    "buttonStyle": "rounded"
  },
  "effects": {
    "animations": true,
    "glowEffects": true,
    "hoverScale": true,
    "transitionDuration": 300,
    "backdropBlur": true
  },
  "assets": {
    "backgroundPattern": "/themes/alien-invasion/starfield.svg"
  },
  "customCSS": "/* Alien Invasion Theme - Compatible with next-themes (light/dark) */\n/* Uses data-site-theme and --site-* variables to avoid conflicts */\n\n/* Neon glow effects */\n:root[data-site-theme='alien-invasion'] .challenge-card,\n:root[data-site-theme='alien-invasion'] .rounded-lg.border {\n  box-shadow: 0 0 10px rgba(57, 255, 20, 0.3);\n  transition: all 0.3s ease;\n}\n\n:root[data-site-theme='alien-invasion'] .challenge-card:hover,\n:root[data-site-theme='alien-invasion'] .rounded-lg.border:hover {\n  box-shadow: 0 0 20px rgba(57, 255, 20, 0.5), 0 0 30px rgba(57, 255, 20, 0.3);\n  transform: translateY(-2px);\n}\n\n/* Animated floating effect */\n@keyframes alien-float {\n  0%, 100% { transform: translateY(0px); }\n  50% { transform: translateY(-10px); }\n}\n\n:root[data-site-theme='alien-invasion'] .alien-float {\n  animation: alien-float 6s ease-in-out infinite;\n}\n\n/* Pulsing glow for primary buttons */\n@keyframes alien-pulse-glow {\n  0%, 100% { box-shadow: 0 0 10px rgba(57, 255, 20, 0.5); }\n  50% { box-shadow: 0 0 20px rgba(57, 255, 20, 0.8), 0 0 30px rgba(57, 255, 20, 0.4); }\n}\n\n:root[data-site-theme='alien-invasion'] button[class*='bg-primary'] {\n  animation: alien-pulse-glow 2s ease-in-out infinite;\n}\n\n/* Glowing borders */\n:root[data-site-theme='alien-invasion'] .border-primary {\n  border-color: var(--site-primary);\n  box-shadow: inset 0 0 10px rgba(57, 255, 20, 0.2);\n}\n\n/* Table row hover with glow */\n:root[data-site-theme='alien-invasion'] tr:hover td {\n  background-color: rgba(57, 255, 20, 0.05);\n  box-shadow: inset 0 0 10px rgba(57, 255, 20, 0.1);\n}\n\n/* Badge styles - hexagonal shape */\n:root[data-site-theme='alien-invasion'] .badge-alien {\n  clip-path: polygon(25% 0%, 75% 0%, 100% 50%, 75% 100%, 25% 100%, 0% 50%);\n  padding: 0.4rem 1rem;\n  background: linear-gradient(135deg, var(--site-primary), var(--site-accent));\n}\n\n/* Starfield background effect - respects dark mode */\n:root[data-site-theme='alien-invasion'] body,\n:root[data-site-theme='alien-invasion'] main {\n  background-image: \n    radial-gradient(2px 2px at 20% 30%, rgba(255, 255, 255, 0.8), transparent),\n    radial-gradient(2px 2px at 60% 70%, rgba(255, 255, 255, 0.6), transparent),\n    radial-gradient(1px 1px at 50% 50%, rgba(255, 255, 255, 0.4), transparent),\n    radial-gradient(1px 1px at 80% 10%, rgba(255, 255, 255, 0.5), transparent),\n    radial-gradient(2px 2px at 90% 60%, rgba(255, 255, 255, 0.7), transparent),\n    radial-gradient(1px 1px at 33% 80%, rgba(255, 255, 255, 0.3), transparent);\n  background-size: 200% 200%;\n  background-color: var(--site-background);\n  animation: alien-twinkle 20s ease-in-out infinite;\n}\n\n@keyframes alien-twinkle {\n  0%, 100% { background-position: 0% 0%; }\n  50% { background-position: 100% 100%; }\n}\n\n/* Sci-fi scan line effect (subtle) */\n:root[data-site-theme='alien-invasion'] body::before {\n  content: '';\n  position: fixed;\n  top: 0;\n  left: 0;\n  right: 0;\n  height: 2px;\n  background: linear-gradient(90deg, transparent, var(--site-primary), transparent);\n  animation: alien-scan 4s linear infinite;\n  opacity: 0.3;\n  pointer-events: none;\n  z-index: 9999;\n}\n\n@keyframes alien-scan {\n  0% { top: 0%; }\n  100% { top: 100%; }\n}\n\n/* Text glow for headings */\n:root[data-site-theme='alien-invasion'] h1,\n:root[data-site-theme='alien-invasion'] h2 {\n  text-shadow: 0 0 10px rgba(57, 255, 20, 0.5);\n}\n\n/* Input focus glow */\n:root[data-site-theme='alien-invasion'] input:focus,\n:root[data-site-theme='alien-invasion'] textarea:focus {\n  border-color: var(--site-primary);\n  box-shadow: 0 0 15px rgba(57, 255, 20, 0.4);\n}\n\n/* Scrollbar styling */\n:root[data-site-theme='alien-invasion'] ::-webkit-scrollbar {\n  width: 10px;\n  background: var(--site-surface);\n}\n\n:root[data-site-theme='alien-invasion'] ::-webkit-scrollbar-thumb {\n  background: linear-gradient(180deg, var(--site-primary), var(--site-secondary));\n  border-radius: 5px;\n  box-shadow: 0 0 10px rgba(57, 255, 20, 0.5);\n}\n\n:root[data-site-theme='alien-invasion'] ::-webkit-scrollbar-thumb:hover {\n  box-shadow: 0 0 15px rgba(57, 255, 20, 0.8);\n}"
}
